{
  "schema_version": "1.0.0",
  "generated_at": "2026-05-06T00:17:43Z",
  "app": {
    "id": "apex-build",
    "name": "Apex-Build Architecture Intelligence Map Example",
    "environment": "production",
    "repo": {
      "provider": "github",
      "url": "https://github.com/spencerandtheteagues/apex-build-platform",
      "default_branch": "main",
      "commit_sha": "example-sha"
    },
    "primary_runtime": "full-stack web app with AI-agent build pipeline",
    "tenancy_model": "multi_tenant_shared_db",
    "data_classification": "confidential"
  },
  "layers": [
    {
      "id": "user_device",
      "name": "User / Device Layer",
      "order": 1,
      "description": "Entry points and untrusted client devices.",
      "trust_zone": "untrusted_client",
      "allowed_inbound_edge_types": [
        "sync_call",
        "async_event",
        "dependency",
        "observability_signal",
        "feature_flag_gate"
      ],
      "allowed_outbound_edge_types": [
        "sync_call",
        "async_event",
        "data_read",
        "data_write",
        "dependency",
        "auth_check",
        "observability_signal",
        "cost_flow"
      ]
    },
    {
      "id": "presentation",
      "name": "Presentation Layer",
      "order": 2,
      "description": "Visible UI composition, routes, component tree, forms, accessibility, error boundaries.",
      "trust_zone": "untrusted_client",
      "allowed_inbound_edge_types": [
        "sync_call",
        "async_event",
        "dependency",
        "observability_signal",
        "feature_flag_gate"
      ],
      "allowed_outbound_edge_types": [
        "sync_call",
        "async_event",
        "data_read",
        "data_write",
        "dependency",
        "auth_check",
        "observability_signal",
        "cost_flow"
      ]
    },
    {
      "id": "client_runtime",
      "name": "Client Runtime Layer",
      "order": 3,
      "description": "API clients, client auth, local cache, offline queue, analytics, flags.",
      "trust_zone": "untrusted_client",
      "allowed_inbound_edge_types": [
        "sync_call",
        "async_event",
        "dependency",
        "observability_signal",
        "feature_flag_gate"
      ],
      "allowed_outbound_edge_types": [
        "sync_call",
        "async_event",
        "data_read",
        "data_write",
        "dependency",
        "auth_check",
        "observability_signal",
        "cost_flow"
      ]
    },
    {
      "id": "edge_api",
      "name": "Edge / API Entry Layer",
      "order": 4,
      "description": "CDN, WAF, API ingress, load balancing, rate limiting, request validation.",
      "trust_zone": "edge",
      "allowed_inbound_edge_types": [
        "sync_call",
        "async_event",
        "dependency",
        "observability_signal",
        "feature_flag_gate"
      ],
      "allowed_outbound_edge_types": [
        "sync_call",
        "async_event",
        "data_read",
        "data_write",
        "dependency",
        "auth_check",
        "observability_signal",
        "cost_flow"
      ]
    },
    {
      "id": "auth_security",
      "name": "Auth / Security Layer",
      "order": 5,
      "description": "Authentication, authorization, tenant isolation, session validation, audit boundaries.",
      "trust_zone": "trusted_backend",
      "allowed_inbound_edge_types": [
        "sync_call",
        "async_event",
        "dependency",
        "observability_signal",
        "feature_flag_gate"
      ],
      "allowed_outbound_edge_types": [
        "sync_call",
        "async_event",
        "data_read",
        "data_write",
        "dependency",
        "auth_check",
        "observability_signal",
        "cost_flow"
      ]
    },
    {
      "id": "application_services",
      "name": "Application Service Layer",
      "order": 6,
      "description": "Handlers, services, domain logic, validation, transactions, background dispatch.",
      "trust_zone": "trusted_backend",
      "allowed_inbound_edge_types": [
        "sync_call",
        "async_event",
        "dependency",
        "observability_signal",
        "feature_flag_gate"
      ],
      "allowed_outbound_edge_types": [
        "sync_call",
        "async_event",
        "data_read",
        "data_write",
        "dependency",
        "auth_check",
        "observability_signal",
        "cost_flow"
      ]
    },
    {
      "id": "ai_agent",
      "name": "AI / Agent Layer",
      "order": 7,
      "description": "Prompt/model routing, context selection, tool execution, code generation, repair planning, cost control.",
      "trust_zone": "privileged_backend",
      "allowed_inbound_edge_types": [
        "sync_call",
        "async_event",
        "dependency",
        "observability_signal",
        "feature_flag_gate"
      ],
      "allowed_outbound_edge_types": [
        "sync_call",
        "async_event",
        "data_read",
        "data_write",
        "dependency",
        "auth_check",
        "observability_signal",
        "cost_flow"
      ]
    },
    {
      "id": "data_access",
      "name": "Data Access Layer",
      "order": 8,
      "description": "Repositories, ORM/query builder, migration rules, transaction scope, schema ownership.",
      "trust_zone": "trusted_backend",
      "allowed_inbound_edge_types": [
        "sync_call",
        "async_event",
        "dependency",
        "observability_signal",
        "feature_flag_gate"
      ],
      "allowed_outbound_edge_types": [
        "sync_call",
        "async_event",
        "data_read",
        "data_write",
        "dependency",
        "auth_check",
        "observability_signal",
        "cost_flow"
      ]
    },
    {
      "id": "persistence",
      "name": "Persistence Layer",
      "order": 9,
      "description": "SQL DB, cache, object storage, vector store, search index, queue storage, backups.",
      "trust_zone": "data",
      "allowed_inbound_edge_types": [
        "sync_call",
        "async_event",
        "dependency",
        "observability_signal",
        "feature_flag_gate"
      ],
      "allowed_outbound_edge_types": [
        "sync_call",
        "async_event",
        "data_read",
        "data_write",
        "dependency",
        "auth_check",
        "observability_signal",
        "cost_flow"
      ]
    },
    {
      "id": "eventing",
      "name": "Eventing / Async Layer",
      "order": 10,
      "description": "Queues, workers, schedulers, pubsub, retry, DLQ, idempotency.",
      "trust_zone": "trusted_backend",
      "allowed_inbound_edge_types": [
        "sync_call",
        "async_event",
        "dependency",
        "observability_signal",
        "feature_flag_gate"
      ],
      "allowed_outbound_edge_types": [
        "sync_call",
        "async_event",
        "data_read",
        "data_write",
        "dependency",
        "auth_check",
        "observability_signal",
        "cost_flow"
      ]
    },
    {
      "id": "observability",
      "name": "Observability Layer",
      "order": 11,
      "description": "Logs, metrics, traces, alerts, SLOs, incident annotations.",
      "trust_zone": "observability",
      "allowed_inbound_edge_types": [
        "sync_call",
        "async_event",
        "dependency",
        "observability_signal",
        "feature_flag_gate"
      ],
      "allowed_outbound_edge_types": [
        "sync_call",
        "async_event",
        "data_read",
        "data_write",
        "dependency",
        "auth_check",
        "observability_signal",
        "cost_flow"
      ]
    },
    {
      "id": "devops_runtime",
      "name": "DevOps / Runtime Platform Layer",
      "order": 12,
      "description": "CI/CD, containers, environment config, deployments, rollbacks, health checks.",
      "trust_zone": "delivery",
      "allowed_inbound_edge_types": [
        "sync_call",
        "async_event",
        "dependency",
        "observability_signal",
        "feature_flag_gate"
      ],
      "allowed_outbound_edge_types": [
        "sync_call",
        "async_event",
        "data_read",
        "data_write",
        "dependency",
        "auth_check",
        "observability_signal",
        "cost_flow"
      ]
    },
    {
      "id": "external_integrations",
      "name": "External Integrations Layer",
      "order": 13,
      "description": "Payments, email, OAuth, AI providers, Git, third-party APIs.",
      "trust_zone": "external",
      "allowed_inbound_edge_types": [
        "sync_call",
        "async_event",
        "dependency",
        "observability_signal",
        "feature_flag_gate"
      ],
      "allowed_outbound_edge_types": [
        "sync_call",
        "async_event",
        "data_read",
        "data_write",
        "dependency",
        "auth_check",
        "observability_signal",
        "cost_flow"
      ]
    }
  ],
  "nodes": [
    {
      "id": "web.frontend",
      "name": "Web Frontend Shell",
      "layer": "presentation",
      "type": "page",
      "description": "Top-level browser app shell and routing frame.",
      "code_locations": [
        {
          "path": "frontend/src/App.tsx"
        },
        {
          "path": "frontend/src/routes/**"
        }
      ],
      "runtime": {
        "language": "TypeScript/Go",
        "framework": "React + backend services",
        "process": "app/runtime",
        "deployment_unit": "web/backend"
      },
      "ownership": {
        "owner": "platform",
        "pager": "platform-oncall",
        "reviewers": [
          "frontend",
          "backend",
          "ai-platform"
        ]
      },
      "interfaces": {
        "inputs": [],
        "outputs": [],
        "contracts": [
          "contract.ui_api.build_sessions"
        ],
        "events_published": [],
        "events_consumed": []
      },
      "data_access": {
        "reads": [],
        "writes": [],
        "transaction_scope": "request/job scoped",
        "tenant_filter_required": true